{
  "schema_version": "1.0",
  "stage": "intel",
  "sample_sha256": "0000000000000000000000000000000000000000000000000000000000000000",
  "status": "completed",
  "summary": "Public-source lookups corroborated one locally observed network indicator, failed to support a persistence hypothesis, and surfaced an external family label that remains enrichment only pending Deepdive review.",
  "provider_queries": [
    {
      "id": "pq.public-sandbox.sha256",
      "provider": "public-sandbox",
      "query_scope": "original_sample",
      "query_type": "sha256",
      "query_value": "0000000000000000000000000000000000000000000000000000000000000000",
      "result": "match",
      "matched_identity": "Public task 4217 for original sample hash",
      "reference": "https://sandbox.example/report/4217",
      "notes": "Public sandbox matched the original sample hash and exposed one matching URL plus a non-authoritative family label."
    },
    {
      "id": "pq.public-reputation.url",
      "provider": "public-reputation",
      "query_scope": "local_ioc",
      "query_type": "url",
      "query_value": "http://update.example.invalid/gate",
      "result": "match",
      "matched_identity": "URL record with two matching public submissions",
      "reference": "https://reputation.example/url/update.example.invalid",
      "notes": "The URL matches a locally observed network indicator from the dynamic stage."
    },
    {
      "id": "pq.public-reputation.registry",
      "provider": "public-reputation",
      "query_scope": "local_ioc",
      "query_type": "registry_key",
      "query_value": "HKCU\\Software\\Example\\Run",
      "result": "no_match",
      "matched_identity": null,
      "reference": null,
      "notes": "No public corroboration was found for the suspected persistence location."
    },
    {
      "id": "pq.public-sandbox.related",
      "provider": "public-sandbox",
      "query_scope": "recovered_artifact",
      "query_type": "sha256",
      "query_value": "1111111111111111111111111111111111111111111111111111111111111111",
      "result": "match",
      "matched_identity": "Related public artifact cluster",
      "reference": "https://sandbox.example/report/related-artifact",
      "notes": "A related public sample cluster suggests the recovered artifact participates in the same loader ecosystem, but the label remains external-only."
    }
  ],
  "claim_checks": [
    {
      "id": "cc.network-loader-url",
      "claim_text": "The sample reaches an outbound update URL during execution.",
      "related_stage": "dynamic",
      "related_finding_ids": [
        "network.http-beacon"
      ],
      "verification_status": "corroborated",
      "provider_query_ids": [
        "pq.public-sandbox.sha256",
        "pq.public-reputation.url"
      ],
      "analysis": "The locally observed URL also appears in public sandbox and reputation records. This supports the network claim without expanding it beyond the locally observed scope.",
      "report_use": "supporting_context"
    },
    {
      "id": "cc.persistence-run-key",
      "claim_text": "The sample establishes Run-key persistence.",
      "related_stage": "static-pass2",
      "related_finding_ids": [
        "persistence.run-key-hypothesis"
      ],
      "verification_status": "no_public_evidence",
      "provider_query_ids": [
        "pq.public-reputation.registry"
      ],
      "analysis": "No public corroboration was found for the suspected Run-key location. Deepdive should keep this claim caveated or reject it unless stronger local evidence exists.",
      "report_use": "caveat_only"
    },
    {
      "id": "cc.family-loader-label",
      "claim_text": "The sample belongs to the ExampleLoader family.",
      "related_stage": "static-pass1",
      "related_finding_ids": [
        "classification.family-label"
      ],
      "verification_status": "public_label_only",
      "provider_query_ids": [
        "pq.public-sandbox.sha256",
        "pq.public-sandbox.related"
      ],
      "analysis": "Public sandbox labels and related-sample clustering suggest a family name, but the label is external-only and should not be treated as confirmed attribution without sufficient local evidence.",
      "report_use": "followup_only"
    }
  ],
  "ioc_correlation": {
    "matched_local": [
      {
        "id": "ioc.network.url",
        "category": "network",
        "value": "http://update.example.invalid/gate",
        "upstream_evidence_ids": [
          "dyn.ev.network-1"
        ],
        "provider_query_ids": [
          "pq.public-sandbox.sha256",
          "pq.public-reputation.url"
        ],
        "notes": "Observed locally and publicly matched."
      }
    ],
    "local_only_no_public_match": [
      {
        "id": "ioc.host.mutex",
        "category": "host",
        "value": "Global\\UpdaterLock",
        "upstream_evidence_ids": [
          "static.ev.mutex-1"
        ],
        "provider_query_ids": [],
        "notes": "Observed locally but not corroborated publicly."
      }
    ],
    "external_only": [
      {
        "id": "ioc.network.ip",
        "category": "network",
        "value": "203.0.113.42",
        "upstream_evidence_ids": [],
        "provider_query_ids": [
          "pq.public-sandbox.sha256"
        ],
        "notes": "Appears only in public sandbox reporting and remains a follow-up lead until locally observed."
      }
    ]
  },
  "enrichment_candidates": [
    {
      "id": "en.family.label",
      "type": "family_label",
      "value": "ExampleLoader",
      "provider_query_ids": [
        "pq.public-sandbox.sha256",
        "pq.public-sandbox.related"
      ],
      "confidence": 0.42,
      "usage": "needs_local_confirmation",
      "notes": "External family naming seen across related public reports."
    },
    {
      "id": "en.public.report",
      "type": "public_report",
      "value": "https://sandbox.example/report/4217",
      "provider_query_ids": [
        "pq.public-sandbox.sha256"
      ],
      "confidence": 0.85,
      "usage": "context_only",
      "notes": "Useful public reference for analyst context."
    },
    {
      "id": "en.behavior.tag",
      "type": "behavior_tag",
      "value": "loader-chain",
      "provider_query_ids": [
        "pq.public-sandbox.sha256"
      ],
      "confidence": 0.58,
      "usage": "context_only",
      "notes": "Public behavior tagging may help prioritize follow-up on additional unpack stages."
    }
  ],
  "limitations": [
    "Public provider data was treated as attributed external evidence only.",
    "No binary submission was required for these lookups.",
    "External-only indicators remain unconfirmed until local analysis reproduces them."
  ],
  "upstream_inputs": [
    "02-static-pass1.json",
    "04-static-pass2.json",
    "05-dynamic.json"
  ]
}
